1,1930-01-01,Poem by Shri Mataji at the age of 7,India,City Unknown,Draft,,,,,N,N,N,Quote,English,0
2,1961-01-01,"Extract from souvenir, Dignity of Art",India,City Unknown,Draft,,,,,N,N,N,Quote,English,0
3,1970-01-01,Unidentified Hindi Talk (extract on Swadishthana),Country Unknown,City Unknown,,Reviewed,,Draft,,Y,Y,N,Talk to Sahaja Yogis,Hindi,6
4,1970-01-01,Unidentified Hindi Talk (Extract on Agnya Chakra),Country Unknown,City Unknown,,VERIFIED,,VERIFIED,,Y,Y,N,Talk to Sahaja Yogis,Hindi,9
5,1970-01-01,"Public Program (incomplete, date, place unknown)",India,City Unknown,,,NEEDED,,NEEDED,N,Y,Y,Public Program,Marathi,0
6,1970-01-01,"Ushering in the Satya Yuga (THE LIFE ETERNAL, 1981 ISSUE, PAGE 1)",Country Unknown,City Unknown,Draft,,,,,N,N,N,Quote,English,0
7,1970-01-01,"Quote (THE LIFE ETERNAL, 1980 ISSUE, PAGE 50)",Country Unknown,City Unknown,Draft,,,,,N,N,N,Quote,English,0
8,1970-01-01,"Quote (THE LIFE ETERNAL, 1980 ISSUE, PAGE 48)",Country Unknown,City Unknown,Draft,,,,,N,N,N,Quote,English,0
9,1970-01-01,"Letter to Dr. Raul, from Nirmala Yoga, Issue 8 (Mar.-Apr. 1982), Page 23",Country Unknown,City Unknown,Draft,,,,,N,N,N,Letters,English,0
10,1970-01-01,"Quote (THE LIFE ETERNAL, 1980 ISSUE, PAGE 13)",Country Unknown,City Unknown,Draft,,,,,N,N,N,Quote,English,0
11,1970-01-01,"Ego and Superego, from Nirmala Yoga, Issue 5 (Sep.-Oct. 1981), Page 4",Country Unknown,City Unknown,Draft,,,,,N,N,N,Quote,English,0
12,1970-01-01,"Letter in Marathi II from Nirmala Yoga, Issue 14 (March-April 1983), Page 11",Country Unknown,City Unknown,,,NEEDED,,Draft,N,N,N,Letters,Marathi,0
13,1970-01-01,"Letter to London Sahaja Yogis from Nirmala Yoga, Issue 4 (May-June 1981), Front Back Cover",Country Unknown,City Unknown,Draft,,,,,N,N,N,Letters,English,0
14,1970-01-01,"Two quotes (MAHA AVATAR, ISSUE 1, JUL-SEP 1980, PAGE 11)",Country Unknown,City Unknown,Draft,,,,,N,N,N,Quote,English,0
15,1970-01-01,"Message (MAHA AVATAR, ISSUE 1, JUL-SEP 1980)",Country Unknown,City Unknown,Draft,,,,,N,N,N,Quote,English,0
16,1970-01-01,"Quote on Shri Agni (ANANT JEEVAN, ISSUE 4, FEB-APR 1980)",Country Unknown,City Unknown,Draft,,,,,N,N,N,Quote,English,0
17,1970-01-01,"Letter from London (THE LIFE ETERNAL, 1980 ISSUE, PAGES 17-18)",Country Unknown,City Unknown,Draft,,,,,N,N,N,Letters,English,0
18,1970-01-01,"BEWARE, DEAR ASPIRANTS  (THE LIFE ETERNAL, 1980 ISSUE, PAGE 25)",Country Unknown,City Unknown,Draft,,,,,N,N,N,Quote,English,0
19,1970-01-01,"Quote Sahaja Smile, from Nirmala Yoga, Issue 14 (March-April 1983), Page 15",Country Unknown,City Unknown,Draft,,,,,N,N,N,Quote,English,0
20,1970-01-01,"Sahaja Yoga a Unique Discovery (THE LIFE ETERNAL, 1980 ISSUE, PAGES 3–8)",Country Unknown,City Unknown,Draft,,,,,N,N,N,Quote,English,0
21,1970-01-01,"Advice to Western Women from Nirmala Yoga, Issue 20 (March-April 1984), Pages 33–38",Country Unknown,City Unknown,Draft,,,,,N,N,N,Quote,English,0
22,1970-01-01,"The Essence of Sahaja Yoga, from Nirmala Yoga, Issue 19, Jan.-Feb. 1984, Pages 28–32",Country Unknown,City Unknown,Draft,,,,,N,N,N,Quote,English,0
23,1970-01-01,"Quote from Nirmala Yoga, Issue 12 (Nov.-Dec. 1982), Page 25",Country Unknown,City Unknown,Draft,,,,,N,N,N,Quote,English,0
24,1970-01-01,"Quote, from Advice given to Sahaja Mothers from Nirmala Yoga, Issue 16 (July-August 1983), Pages 29–31",Country Unknown,City Unknown,Draft,,,,,N,N,N,Quote,English,0
25,1970-01-01,"Letter (THE LIFE ETERNAL, 1979 ISSUE)",Country Unknown,City Unknown,Draft,,,,,N,N,N,Letters,English,0
26,1970-01-01,"Quote 2, from Advice given to Sahaja Mothers from Nirmala Yoga, Issue 16 (July-August 1983), Pages 29–31",Country Unknown,City Unknown,Draft,,,,,N,N,N,Quote,English,0
27,1970-01-01,"Quote 1 from Nirmala Yoga, Issue 13 (Jan.-Feb. 1983), Pages 23 and 25",Country Unknown,City Unknown,Draft,,,,,N,N,N,Quote,English,0
28,1970-01-01,"Quote 2 from Nirmala Yoga, Issue 13 (Jan.-Feb. 1983), Page 25",Country Unknown,City Unknown,Draft,,,,,N,N,N,Quote,English,0
29,1970-01-01,"Quote 3 from Nirmala Yoga, Issue 13 (Jan.-Feb. 1983), Page 25",Country Unknown,City Unknown,Draft,,,,,N,N,N,Quote,English,0
30,1970-01-01,Unidentified Public Programme,Country Unknown,City Unknown,VERIFIED,,,,,Y,N,N,Public Program,English,11
31,1970-01-01,Letter in Marathi III from Nirmala Yoga,Country Unknown,City Unknown,,,NEEDED,,Draft,N,N,N,Letters,Marathi,0
32,1970-01-01,Two quotes from “The Origins of the Nervous System” dated 1993-1106,Country Unknown,City Unknown,Draft,,,,,N,N,N,Quote,English,0
33,1970-01-01,"Letter, Meaning of Puja",Country Unknown,City Unknown,Draft,,,,,N,N,N,Letters,English,0
34,1970-01-01,Letter in Marathi,Country Unknown,City Unknown,,,NEEDED,,Draft,N,N,N,Letters,Marathi,0
35,1970-01-01,Ardha Matra Volume 2 Interview,India,City Unknown,,"In Progress, NEEDED",,Draft,,N,Y,N,Interview,Hindi,26
36,1970-01-01,Ardha Matra Volume 5 two interviews or talks in Hindi (no audio),India,City Unknown,,"In Progress, NEEDED",,NEEDED,,N,Y,N,Interview,Hindi,16
37,1970-01-01,Handwritten Notes on Leadership,Country Unknown,City Unknown,Draft,,,,,N,N,N,Quote,English,0
38,1972-01-01,Letter,United States,City Unknown,Draft,,,,,N,N,N,Letters,English,0
39,1972-01-01,Poem: To My Flower Children,United States,City Unknown,Draft,,,,,N,N,N,Letters,English,0
40,1972-01-01,Public Program,India,Mumbai,,,"In Progress, NEEDED",,NEEDED,Y,N,N,Public Program,Marathi,54
41,1972-04-09,Public Program,India,Dhule,,,Reviewed,,NEEDED,Y,N,N,Public Program,Marathi,71
42,1972-06-01,"Guru Purnima, Sahaja Yoga a New Discovery",India,Mumbai,,"Draft, In Progress",,Draft,,Y,N,N,Guru,Hindi,60
43,1973-01-25,Public Program,India,Bordi,,VERIFIED,,Draft,,Y,N,N,Public Program,Hindi,10
44,1973-03-23,Public Program Day 1,India,Mumbai,"In Progress, NEEDED",,,,,Y,N,N,Public Program,English,37
45,1973-03-24,Public Program Day 2,India,Mumbai,Draft,,,,,Y,N,N,Public Program,English,60
46,1973-03-25,Public Program Day 3,India,Mumbai,Draft,,,,,Y,N,N,Public Program,English,60
47,1973-08-28,Shri Krishna Puja: Most Dynamic Power of Love,India,Mumbai,VERIFIED,,,,,Y,N,N,Krishna,English,34
48,1973-09-03,Understand your importance,India,Mumbai,,"Draft, In Progress",,VERIFIED,,Y,N,N,Talk to Sahaja Yogis,Hindi,58
49,1973-09-10,"Public Program, Bholapan, Innocence",India,City Unknown,,Draft,,VERIFIED,,Y,N,N,Public Program,Hindi,53
50,1973-09-14,Public Program,India,Pune,,,,,NEEDED,Y,N,N,Public Program,Marathi,62
51,1973-09-16,Talk,India,Pune,,,"In Progress, NEEDED",,"In Progress, NEEDED",Y,N,N,Public Program,Marathi,71
52,1973-09-19,Public Program,India,Pune,,,,,NEEDED,Y,N,N,Public Program,Marathi,60
53,1973-11-15,Kundalini Ani Sahajayoga,India,Mumbai,,,"Draft, In Progress",,"In Progress, NEEDED",Y,N,N,Public Program,Marathi,53
54,1973-11-17,Kundalini Your Divine Mother In You,India,New Delhi,,Draft,,Draft,,Y,N,N,Public Program,Hindi,33
55,1973-11-19,Sahaj Yog,India,New Delhi,"In Progress, NEEDED",,,,,Y,N,N,Public Program,English,56
56,1973-11-24,Question And Answers,India,New Delhi,Draft,,,,,Y,N,N,Public Program,English,31
57,1973-11-25,"Seven Chakras and their Deities, Paane ke baad",India,Mumbai,,Draft,,Draft,,Y,N,N,Public Program,Hindi,42
58,1973-12-07,"Sahaja Yoga ki Utpatti, The origin of Sahaja Yoga",India,Mumbai,VERIFIED,Draft,,Reviewed,,Y,N,N,Public Program,Hindi,45
59,1973-12-08,Public Program,India,Mumbai,,"Draft, In Progress",,"In Progress, NEEDED",,Y,N,N,Public Program,Hindi,57
60,1973-12-09,"Seminar on Shri Dattatreya Jayanti, Day 3",India,Mumbai,,Draft,,Draft,,Y,N,N,Public Program,Hindi,43
61,1973-12-22,Public Program,India,Nagpur,,Draft,,Draft,,Y,N,N,Public Program,Hindi,44
62,1974-03-25,Public Program Day 1,India,Mumbai,,Draft,,Reviewed,,Y,N,N,Public Program,Hindi,71
63,1974-03-26,Public Program Day 2,India,Mumbai,,"Draft, In Progress",,Reviewed,,Y,N,N,Public Program,Hindi,35
64,1974-03-27,Public Program Day 3: Vibrations that is Love,India,Mumbai,,Draft,,VERIFIED,,Y,N,N,Public Program,Hindi,74
65,1975-01-01,Dharm Va Adharm,India,City Unknown,,Draft,,Draft,,Y,N,N,Talk to Sahaja Yogis,Hindi,40
66,1975-01-01,"Letter to Sahaja Yogis, Parklands, Ice House Wood, Oxted, Surrey (ANANT JEEVAN, ISSUE 4, Feb-April 1980)",England,Oxted,Draft,,,,,N,N,N,Letters,English,0
67,1975-01-20,"Talk to Sahaja Yogis, Kshma Ki Shakti Ka Mahatav, Power of Forgiveness",India,Mumbai,,Draft,,"Draft, In Progress",,Y,N,N,Talk to Sahaja Yogis,Hindi,57
68,1975-01-21,Teen Shaktiya (Three Powers),India,Mumbai,,VERIFIED,Draft,VERIFIED,,Y,N,N,Talk to Sahaja Yogis,"Hindi, Marathi",24
69,1975-01-22,"Talk, Bholepana ani nirvicharitecha killa",India,Mumbai,,,"Draft, In Progress",,"Draft, In Progress",Y,N,N,Talk to Sahaja Yogis,Marathi,31
70,1975-01-23,Seminar,India,Mumbai,,Draft,Draft,Draft,,Y,N,N,Talk to Sahaja Yogis,"Hindi, Marathi",56
71,1975-01-25,Talk to Sahaja Yogis: Must listen every day,India,Mumbai,,Draft,,Draft,,Y,N,N,Talk to Sahaja Yogis,Hindi,44
72,1975-02-09,"Meditation and Prayer, Prayer To The Almighty, Dhyan Aur Prathna",India,Mumbai,,Reviewed,,Draft,,Y,N,N,Talk to Sahaja Yogis,Hindi,44
73,1975-02-13,Public Program,India,Dadar,,"In Progress, NEEDED",,Draft,,Y,N,N,Public Program,Hindi,32
74,1975-02-16,Public Program: Sharirik bimariya Vaibration se thik ho sakti hai,India,Mumbai,,Draft,,"In Progress, NEEDED",,Y,N,N,Public Program,Hindi,55
75,1975-02-19,Public Program,India,Mumbai,"In Progress, NEEDED",,,,,Y,N,N,Public Program,English,51
76,1975-03-01,Talk,India,New Delhi,Draft,,,,,N,N,N,Talk to Sahaja Yogis,English,0
77,1975-03-03,Public Program: Parmatma ka swarup,India,Mumbai,,Draft,,Draft,,Y,N,N,Public Program,Hindi,38
78,1975-03-05,Public Program: Chitt apni aur rakhiye,India,Mumbai,,Draft,,"In Progress, NEEDED",,Y,N,N,Public Program,Hindi,46
79,1975-03-13,Gunateet – Beyond the Three Gunas,India,City Unknown,,Draft,,Draft,,Y,N,N,Talk to Sahaja Yogis,Hindi,32
80,1975-03-17,Public Program,India,Mumbai,,Draft,,"In Progress, NEEDED",,Y,N,N,Public Program,Hindi,95
81,1975-03-18,Talk to Sahaja Yogis,India,Mumbai,,Draft,,Draft,Draft,Y,N,N,Talk to Sahaja Yogis,Hindi,5
82,1975-03-29,Public Program: Science/Trigunatmika,India,Mumbai,,Draft,,Draft,,Y,N,N,Public Program,Hindi,26
83,1975-03-30,"Public Program 2, Science, Trigunatmika",India,Mumbai,,Draft,,"In Progress, NEEDED",,Y,N,N,Public Program,Hindi,31
84,1975-03-31,Talk to Sahaja Yogis,India,Mumbai,,Draft,,Draft,,Y,N,N,Talk to Sahaja Yogis,Hindi,15
85,1975-05-05,Letter on Mithya,Country Unknown,City Unknown,Draft,,,,,N,N,N,Letters,English,0
86,1975-11-08,"Letter, 8th November",England,London,Draft,,,,,N,N,N,Letters,English,0
87,1975-11-25,Talk,India,Mumbai,,"In Progress, NEEDED",,Draft,,Y,N,N,Public Program,Hindi,44
88,1975-12-21,Talk to Sahaja Yogis,India,Mumbai,,,"In Progress, NEEDED",,Draft,Y,N,N,Talk to Sahaja Yogis,Marathi,29
89,1975-12-21,Keep the attention on yourself,India,Mumbai,,Draft,,Draft,,Y,N,N,Talk to Sahaja Yogis,Hindi,54
90,1975-12-22,"Public Program, The Experience Of God’s Love, Prabhu ke Prem ka Anubhav (or 27th)",India,Mumbai,,"In Progress, NEEDED",,Draft,,Y,N,N,Public Program,Hindi,70
91,1975-12-23,"Public Program, God’s Love, Parmatma Ka Prem, Bal Mohan Mandir",India,Mumbai,,Draft,,Draft,,Y,N,N,Public Program,Hindi,40
92,1975-12-26,Public Program: God’s Love,India,Mumbai,,"Draft, In Progress",,Reviewed,,Y,N,N,Public Program,Hindi,40
93,1976-01-23,Description of Kundalini,India,New Delhi,Draft,,,,,Y,N,N,Public Program,English,62
94,1976-02-05,Lalita Panchami Puja,India,Mumbai,,Draft,,Draft,,Y,N,N,Devi,Hindi,20
95,1976-02-29,Mahashivaratri Puja: Utpatti – Adi Shakti aur Shiva ka Swaroop,India,Mumbai,,VERIFIED,,VERIFIED,,Y,N,N,Mahashivaratri,Hindi,20
96,1976-03-02,Shri Brahmadeva havan – Prajapati yagnya: Lord of Creatures,India,Mumbai,,Draft,,Draft,,Y,N,N,Havan,Hindi,23
97,1976-03-14,Public Program,India,Rahuri,,,"In Progress, NEEDED",,NEEDED,Y,N,N,Public Program,Marathi,22
98,1976-03-19,Seminar Day 1 (incomplete),India,City Unknown,Draft,,,,,Y,N,N,Talk to Sahaja Yogis,English,20
99,1976-03-20,Letter,India,Mumbai,Draft,,,,,N,N,N,Letters,English,0
100,1976-03-30,"Gudi Padwa, Meditation in thoughtless awareness",India,New Delhi,VERIFIED,,,,,Y,N,N,Gudi Padwa,English,30
101,1976-04-02,"The Role of Tongue, Sight and Feet in Spiritual Evolution",India,New Delhi,VERIFIED,,,,,Y,N,N,Talk to Sahaja Yogis,English,20
102,1976-04-06,Nirvicharita,India,Mumbai,,Draft,Draft,"In Progress, NEEDED","In Progress, NEEDED",Y,N,N,Talk to Sahaja Yogis,"Hindi, Marathi",57
103,1976-05-10,Letter,Country Unknown,City Unknown,Draft,,,,,N,N,N,Letters,English,0
104,1976-05-27,"Sahajayoga Baddal Sarvanna Sangayche, Responsibility of Sahaja Yoga",India,Mumbai,,,VERIFIED,,VERIFIED,Y,N,N,Talk to Sahaja Yogis,Marathi,38
105,1976-05-29,"Dhyan Kaise Karein, How to Meditate",India,Mumbai,,"In Progress, NEEDED",,Reviewed,,Y,N,N,Public Program,Hindi,45
106,1976-05-29,Sahajyog Sagalyana Samgra Karto,India,Mumbai,,,"Draft, In Progress",,Draft,Y,N,N,Talk to Sahaja Yogis,Marathi,30
107,1976-09-06,Letter,England,London,Draft,,,,,N,N,N,Letters,English,0
108,1976-09-22,Letter,England,London,Draft,,,,,N,N,N,Letters,English,0
109,1976-10-12,Letter about Dharma,England,London,Draft,,,,,N,N,N,Letters,English,0
110,1976-10-21,"Letter, Diwali",Country Unknown,City Unknown,Draft,,,,,N,N,N,Letters,English,0
111,1976-12-18,2nd Talk,India,Mumbai,,,"In Progress, NEEDED",,NEEDED,Y,N,N,Talk to Sahaja Yogis,Marathi,23
112,1976-12-18,"Sahajayogyanmadhe Dharma Stapna Aur Sahajayog, Dharma has to be established Within",India,Mumbai,,,Draft,,NEEDED,Y,N,N,Talk to Sahaja Yogis,Marathi,29
113,1976-12-22,Spirits of the dead,India,Mumbai,VERIFIED,,,NEEDED,,Y,N,N,Talk to Sahaja Yogis,"English, Hindi",65
114,1977-01-01,The Spirit,Country Unknown,City Unknown,VERIFIED,,,,,Y,N,N,Talk to Sahaja Yogis,English,19
115,1977-01-03,"Samarpan, Surrender",India,Mumbai,"Draft, In Progress",Reviewed,,Draft,,Y,N,N,Public Program,"English, Hindi",7
116,1977-01-19,Public Program,India,Satara,,,"In Progress, NEEDED",,NEEDED,Y,N,N,Public Program,Marathi,59
117,1977-01-26,"Seminar Day 1, Questions and Answers, Advice to Realised Souls",India,Bordi,VERIFIED,,,,,Y,N,N,Talk to Sahaja Yogis,English,73
118,1977-01-26,Talk on Attention,India,City Unknown,"Draft, In Progress",,,,NEEDED,Y,N,N,Talk to Sahaja Yogis,English,23
119,1977-01-27,"Seminar Day 2, Attention and Joy",India,City Unknown,VERIFIED,,,,,Y,N,N,Talk to Sahaja Yogis,English,48
120,1977-01-29,Letter,India,Mumbai,Draft,,,,,N,N,N,Letters,English,0
121,1977-02-01,Nabhi Chakra,India,City Unknown,VERIFIED,,,,,Y,N,N,Talk to Sahaja Yogis,English,13
122,1977-02-01,Heart Chakra (extract),India,City Unknown,VERIFIED,,,,,Y,N,N,Talk to Sahaja Yogis,English,23
123,1977-02-03,Talk to Yogis,India,Mumbai,Draft,"In Progress, NEEDED",,Draft,,Y,N,N,Talk to Sahaja Yogis,Hindi,53
124,1977-02-15,Sat Chit Anand,India,New Delhi,VERIFIED,"In Progress, NEEDED",,Draft,,Y,N,N,Public Program,"English, Hindi",74
125,1977-02-16,Mahashivaratri Puja: Sat-Chit-Ananda,India,New Delhi,,Draft,,Draft,,Y,N,N,Mahashivaratri,Hindi,42
126,1977-02-19,"Talk To New Yogis, Problems From Fake Gurus",India,New Delhi,VERIFIED,Draft,,Draft,,Y,N,N,Talk to Sahaja Yogis,"English, Hindi",49
127,1977-02-20,The Creation,India,New Delhi,VERIFIED,,,,,Y,N,N,Talk to Sahaja Yogis,English,74
128,1977-02-22,Public Program: About different Chakras and their Deities,India,New Delhi,VERIFIED,,,,,Y,N,N,Public Program,English,113
129,1977-02-23,The Normal Human Awareness,India,New Delhi,Reviewed,,,,,Y,N,N,Public Program,English,65
130,1977-02-23,"Interview feature, Evening News (THE LIFE ETERNAL, 1979 ISSUE)",India,New Delhi,Draft,,,,,N,N,N,Interview,English,0
131,1977-03-16,Sab Chijo me Mahamantra ho,India,City Unknown,,Draft,,"In Progress, NEEDED",,Y,N,N,Talk to Sahaja Yogis,Hindi,74
132,1977-03-21,Birthday Puja: Understanding Sahaja Yoga Through Heart,India,Mumbai,VERIFIED,,,,,Y,N,N,Birthday,English,74
133,1977-03-22,Advice at Bharatiya Vidya Bhavan,India,Mumbai,Draft,,"In Progress, NEEDED",,,Y,N,N,Talk to Sahaja Yogis,"English, Marathi",75
134,1977-03-23,Prem Dharma,India,Mumbai,,Draft,,Reviewed,,Y,N,N,Talk to Sahaja Yogis,Hindi,62
135,1977-03-25,Sahaja Yoga is a big blessing,India,Kalwa,,,Draft,Reviewed,,Y,N,N,Talk to Sahaja Yogis,Marathi,23
136,1977-04-27,Letter,England,London,Draft,,,,,N,N,N,Letters,English,0
137,1977-05-01,Letter to Indian Yogis,England,City Unknown,,,NEEDED,,Draft,N,N,N,Letters,Marathi,0
138,1977-05-01,"Letter, May",Country Unknown,City Unknown,Draft,,,,,N,N,N,Letters,English,0
139,1977-05-12,Letter,England,London,Draft,,,,,N,N,N,Letters,English,0
140,1977-07-01,Guru Puja: “The promises you have to make”,England,London,VERIFIED,,,,,Y,N,N,Guru,English,18
141,1977-07-01,Letter on Guru Purnima,Country Unknown,City Unknown,Draft,,,,,N,N,N,Letters,English,0
142,1977-07-06,Devi Puja: “Our roots have to go down into dharma”,England,St Albans,VERIFIED,,,,,Y,N,N,Devi,English,32
143,1977-07-31,Public Program: Kundalini and Self-Realisation,England,London,"Draft, In Progress",,,,,Y,N,N,Public Program,English,48
144,1977-09-02,Letter,England,London,Draft,,,,,N,N,N,Letters,English,0
145,1977-09-09,Letter,England,London,,Draft,,Draft,,N,N,N,Letters,Hindi,0
146,1977-10-16,Letter,England,London,Draft,,,,,N,N,N,Letters,English,0
147,1977-11-21,Tantrism,England,London,Draft,,,,,Y,N,N,Public Program,English,76
148,1977-11-24,"The Mind and Its Relationship to Kundalini, Ego, Superego & Subconscious",England,London,Draft,,,,,Y,N,N,Talk to Sahaja Yogis,English,82
149,1977-11-28,God and Creation,England,London,"In Progress, NEEDED",,,,,Y,N,N,Public Program,English,75
150,1977-12-01,Talk in Stockwell,England,London,Draft,,,,,Y,N,N,Talk to Sahaja Yogis,English,80
151,1977-12-18,The role of Chitta,India,City Unknown,,,"Draft, In Progress",,Draft,Y,N,N,Talk to Sahaja Yogis,Marathi,56
152,1977-12-28,"Atma Ki Anubhuti, Meeting Speech",India,City Unknown,,Reviewed,,Draft,,Y,N,N,Talk to Sahaja Yogis,Hindi,39
153,1978-01-01,New Year’s Day Talk before Havan,India,City Unknown,Draft,,,,,Y,N,N,Talk to Sahaja Yogis,English,63
154,1978-01-30,"Sahajyog, Kundalini aur Chakra",India,Mumbai,,Draft,,"In Progress, NEEDED",,Y,N,N,Talk to Sahaja Yogis,Hindi,75
155,1978-01-31,"Public Program, Void, Heart, Vishuddhi, Channels",India,New Delhi,,NEEDED,,NEEDED,,Y,N,N,Public Program,Hindi,49
156,1978-01-31,"Advice, Part 1, Rajoguna and Swadishthana Chakra, Lakshmipati",India,New Delhi,,"In Progress, NEEDED",,Draft,,Y,N,N,Talk to Sahaja Yogis,Hindi,55
157,1978-02-01,Public Program: Brahmajana,India,New Delhi,,Reviewed,,Draft,,Y,N,N,Public Program,Hindi,61
158,1978-02-03,The three Gunas – The significance of Indian culture,India,New Delhi,,Draft,,Draft,,Y,N,N,Talk to Sahaja Yogis,Hindi,74
159,1978-02-20,Deeper Meditation,England,London,VERIFIED,,,,,Y,N,N,Talk to Sahaja Yogis,English,32
160,1978-02-20,Nabhi Chakra,England,London,Draft,,,,,Y,N,N,Talk to Sahaja Yogis,English,10
161,1978-02-20,"Spirit, Attention, Mind",England,London,VERIFIED,,,,,Y,N,N,Talk to Sahaja Yogis,English,64
162,1978-03-20,We are all seeking,England,London,VERIFIED,,,,,Y,N,N,Public Program,English,48
163,1978-03-26,Easter Seminar,England,London,Draft,,,,,Y,N,N,Easter,English,63
164,1978-04-08,Satya Yuga: The Unconscious,England,London,"In Progress, NEEDED",,,,,Y,N,N,Public Program,English,67
165,1978-05-01,Letter to Delhi yogis,England,London,Draft,,,,,N,N,N,Letters,English,0
166,1978-06-12,"Rationalism, Emotionalism And Wisdom",England,London,VERIFIED,,,,,Y,N,N,Public Program,English,32
167,1978-06-19,The Difference Between East & West,England,London,VERIFIED,,,,,Y,N,N,Public Program,English,62
168,1978-06-26,What happens after Self-realisation?,England,London,VERIFIED,,,,,Y,N,N,Public Program,English,65
169,1978-07-10,Kundalini,England,London,VERIFIED,,,,,Y,N,N,Public Program,English,54
170,1978-07-17,"Ego, The West, Love & Money",England,London,VERIFIED,,,,,Y,N,N,Public Program,English,62
171,1978-07-21,Guru Puja: Your own dignity and gravity,England,London,VERIFIED,,,,,Y,N,N,Guru,English,22
172,1978-08-07,Letter on Raksha-Bandhan,Country Unknown,City Unknown,Draft,,,,,N,N,N,Letters,English,0
173,1978-09-11,The Principle of Brahma,England,London,VERIFIED,,,,,Y,N,N,Public Program,English,47
174,1978-09-25,Public Program: Stupefied Through Ego,England,London,Draft,,,,,Y,N,N,Public Program,English,32
175,1978-10-02,Knots On The Three Channels,England,London,VERIFIED,,,,,Y,N,N,Public Program,English,91
176,1978-10-03,Letter for Navaratri,England,London,,,NEEDED,,Draft,N,N,N,Letters,Marathi,0
177,1978-10-05,Talk to Sahaja Yogis: Dharma,England,London,VERIFIED,,,,,Y,N,N,Talk to Sahaja Yogis,English,72
178,1978-10-14,"Seminar Day 1, Bija Mantras, Shri Lalita, Shri Chakra",England,Wokingham,VERIFIED,,,,,Y,N,N,Talk to Sahaja Yogis,English,44
179,1978-10-15,"Seminar Day 2, Zen Void",England,Bracknell,Draft,,,,,Y,N,N,Talk to Sahaja Yogis,English,57
180,1978-10-23,The Three Channels,England,London,Draft,,,,,Y,N,N,Public Program,English,58
181,1978-10-30,Public Program,England,London,Draft,,,,,Y,N,N,Public Program,English,86
182,1978-11-13,Evolution Beyond organised Religion,England,London,Draft,,,,,Y,N,N,Public Program,English,94
183,1978-11-20,The first three Chakras or How to approach Sahaja Yoga,England,London,"In Progress, NEEDED",,,,,Y,N,N,Public Program,English,84
184,1978-11-27,Rising above the three Channels,England,London,"In Progress, NEEDED",,,,,Y,N,N,Public Program,English,46
185,1978-12-09,"Our Understanding of Sahaja Yoga, Seminar",England,London,VERIFIED,,,,,Y,N,N,Talk to Sahaja Yogis,English,86
186,1978-12-18,Agnya Chakra,England,London,VERIFIED,,,,,Y,N,N,Public Program,English,75
187,1978-12-24,"Christmas Message, Thankfulness",England,London,VERIFIED,,,,,Y,N,N,Talk to Sahaja Yogis,English,15
188,1979-01-01,Letter Human Chitta has many illusions,Country Unknown,City Unknown,,,NEEDED,,Draft,N,N,N,Letters,Marathi,0
189,1979-01-01,Letter,England,London,Draft,,,,,N,N,N,Letters,English,0
190,1979-01-09,What is the Kundalini and how it awakens,India,Mumbai,,NEEDED,,Draft,,Y,N,N,Public Program,Hindi,72
191,1979-01-14,Makar Sankranti Puja,India,Mumbai,,Draft,,"In Progress, NEEDED",,Y,N,N,Makar Sankranti,Hindi,57
192,1979-01-14,Seminar,India,Mumbai,,NEEDED,,VERIFIED,,Y,N,N,Talk to Sahaja Yogis,Hindi,58
193,1979-01-15,Seminar Day 2,India,Mumbai,,NEEDED,,Draft,NEEDED,Y,N,N,Talk to Sahaja Yogis,"Hindi, Marathi",67
194,1979-01-16,Shri Ganesha & Mooladhara Chakra,India,Mumbai,,Draft,,"In Progress, NEEDED",,Y,N,N,Public Program,Hindi,54
195,1979-01-17,Deities on all chakras,India,Mumbai,,NEEDED,,NEEDED,,Y,N,N,Public Program,Hindi,107
196,1979-01-19,Seminar,India,Kalwa,,,"Draft, In Progress",,"Draft, In Progress",Y,N,N,Talk to Sahaja Yogis,Marathi,74
197,1979-01-22,"Seminar, Avdhootas",India,Mumbai,,,"In Progress, NEEDED",,Draft,Y,N,N,Talk to Sahaja Yogis,Marathi,46
198,1979-01-26,Seminar,India,Mumbai,,NEEDED,,NEEDED,,Y,N,N,Talk to Sahaja Yogis,Hindi,33
199,1979-02-01,"Creation, Man and his fulfillment (Universe is a beautiful cosmos)",India,New Delhi,VERIFIED,,,,,Y,N,N,Public Program,English,35
200,1979-02-09,Talk to Sahaja Yogis: Mooladhara Chakra,India,Thiruvananthapuram,VERIFIED,,,,,Y,N,N,Talk to Sahaja Yogis,English,46
201,1979-02-09,False gurus,India,Kovalam,VERIFIED,,,,,Y,N,N,Public Program,English,16
202,1979-02-21,Seminar Day 1,India,Rahuri,,,"In Progress, NEEDED",,NEEDED,Y,N,N,Talk to Sahaja Yogis,"English, Marathi",73
203,1979-02-22,Seminar Day 2,India,Rahuri,,,NEEDED,,NEEDED,Y,N,N,Talk to Sahaja Yogis,Marathi,85
204,1979-02-23,"Seminar, Kundalini Shakti and the Seven Chakras",India,Ahmednagar,,,Draft,,Draft,Y,N,N,Talk to Sahaja Yogis,Marathi,72
205,1979-02-24,Seminar Day 3,India,Rahuri,,,Draft,,"In Progress, NEEDED",Y,N,N,Talk to Sahaja Yogis,Marathi,57
206,1979-02-25,Sahajayogyanshi Hitguj,India,Pune,,,Draft,,NEEDED,Y,N,N,Talk to Sahaja Yogis,Marathi,56
207,1979-02-25,Puja,India,Pune,,,Draft,,"In Progress, NEEDED",Y,N,N,Devi,Marathi,61
208,1979-02-25,Parmeswarane Aplya Samrajyat Bolavale Aahe,India,Pune,,,Draft,,"In Progress, NEEDED",Y,N,N,Talk to Sahaja Yogis,Marathi,47
209,1979-02-26,Puja,India,Pune,,,Draft,,NEEDED,Y,N,N,Devi,Marathi,115
210,1979-02-27,Seminar in Dole,India,Rahuri,,,Draft,,Draft,Y,N,N,Talk to Sahaja Yogis,Marathi,39
211,1979-03-01,"Message (THE LIFE ETERNAL, 1979 ISSUE)",India,New Delhi,Draft,,,,,N,N,N,Quote,English,0
212,1979-03-04,Seminar,India,Dehradun,,"Draft, In Progress",,Draft,,Y,N,N,Talk to Sahaja Yogis,Hindi,58
213,1979-03-08,How to Realise the Self,India,New Delhi,VERIFIED,NEEDED,,Draft,,Y,N,N,Public Program,"English, Hindi",45
214,1979-03-09,Seminar Day 1,India,New Delhi,,Draft,,Draft,,Y,N,N,Talk to Sahaja Yogis,Hindi,46
215,1979-03-10,"Seminar Day 2, Bharatvarsha Yoga Bhoomi",India,New Delhi,,Draft,,Draft,,Y,N,N,Talk to Sahaja Yogis,Hindi,50
216,1979-03-11,Talk about Gandhi,India,New Delhi,Draft,Draft,,Draft,,Y,N,N,Talk to Sahaja Yogis,"English, Hindi",70
217,1979-03-11,Public Program,India,New Delhi,,NEEDED,,Draft,,Y,N,N,Public Program,Hindi,68
218,1979-03-12,Public Program: Mooladhara,India,New Delhi,Draft,Draft,,Draft,,Y,N,N,Public Program,"English, Hindi",48
219,1979-03-13,Seminar,India,New Delhi,Draft,"In Progress, NEEDED",,NEEDED,,Y,N,N,Talk to Sahaja Yogis,"English, Hindi",80
220,1979-03-14,Shri Mataji commenting on Early SY Experiences,India,New Delhi,Draft,,,,,Y,N,N,Talk to Sahaja Yogis,English,92
221,1979-03-15,Talk to Sahaja Yogis,India,New Delhi,,Draft,,Draft,,Y,N,N,Talk to Sahaja Yogis,Hindi,69
222,1979-03-16,Vishuddhi Chakra,India,New Delhi,,"Draft, In Progress",,Draft,,Y,N,N,Public Program,Hindi,88
223,1979-03-18,Public Program: Sahasrara,India,New Delhi,,NEEDED,,NEEDED,,Y,N,N,Public Program,Hindi,73
224,1979-03-21,Birthday Puja,India,Mumbai,,VERIFIED,,Draft,,Y,N,N,Birthday,Hindi,35
225,1979-03-22,Puja,India,City Unknown,,NEEDED,,NEEDED,,Y,N,N,Devi,Hindi,72
226,1979-03-22,Sahaja Yoga & the Subtle System,India,Mumbai,,Draft,,"In Progress, NEEDED",,Y,N,N,Talk to Sahaja Yogis,Hindi,59
